video_id,title,published_date,content_category
vOulw4mtgCc,Lets Larp.  #roblox #jjkgame #jujutsushenanigans  #jujutsukaisen,2026-06-19,Jujutsu Shenanigans (JJS)
vuT47tzgGiA,He got it...  #roblox #jjkgame #gaming #anime,2026-06-19,Jujutsu Shenanigans (JJS)
QrdDptGe47Y,So Close To Summoning Mahoraga  #roblox #jjkgame #jujutsushenanigans,2026-06-19,Jujutsu Shenanigans (JJS)
TBKyF2yBaJY,I've Never Been Broke Like This Before... #roblox #jjkgame #anime,2026-06-19,Jujutsu Shenanigans (JJS)
zYqJx3qaWqc,The JJS Special  #roblox #jjkgame #anime,2026-06-19,Jujutsu Shenanigans (JJS)
6YJlCGo5jDY,Peak Update.  #roblox #jjkgame #anime #jujutsushenanigans,2026-06-19,Jujutsu Shenanigans (JJS)
mwtanWOUHHA,Stupid Combo  #roblox #jjkgame #jujutsushenanigans  #anime,2026-06-19,Jujutsu Shenanigans (JJS)
QeB4QC6_Wew,Is This THE infinite tsukuyomi??  #roblox #jjkgame #jujutsushenanigans #jujutsukaisen,2026-06-19,Jujutsu Shenanigans (JJS)
HkimnWAcQdg,Summoning Mahoraga in duels  #roblox #jjkgame #anime,2026-06-19,Jujutsu Shenanigans (JJS)
KNOpRyi2rYs,How Did I Miss?  #roblox #jjkgame #jujutsushenanigans #anime,2026-06-19,Jujutsu Shenanigans (JJS)
XF5aETaEg1c,Every Lobby... #roblox #jjkgame #jujutsushenanigans,2026-06-19,Jujutsu Shenanigans (JJS)
wCebM9QLv7Y,Think Big Raga.  #roblox #jjkgame #jujutsushenanigans  #jujutsukaisen,2026-06-19,Jujutsu Shenanigans (JJS)
B-2YW_MaORU,Big Raga Really Couldn't  Adapt... Just Like In The Anime. #roblox #jjkgame #anime,2026-06-19,Jujutsu Shenanigans (JJS)
LIg8FaUfD0s,Very Large Hammer. (New Video Out NOW!!)  #roblox #jujutsushenanigans #jjkgame,2026-06-19,Jujutsu Shenanigans (JJS)
ZFJPTn7kD_o,Why'd he just explode  #roblox  #jjkgame #jujutsushenanigans  #jujutsukaisen,2026-06-19,Jujutsu Shenanigans (JJS)
hX0oNwWQ0eU,Jumping People With Mechamaru   #roblox #jjkgame #jujutsushenanigans,2026-06-19,Jujutsu Shenanigans (JJS)
lWFGOp1Hc74,Just Straight Shenanigans...  #roblox #jjkgame #jujutsushenanigans,2026-06-19,Jujutsu Shenanigans (JJS)
6J291f-hzSY,his head...it's gone  #roblox #jujutsushenanigans #gaming,2026-06-19,Jujutsu Shenanigans (JJS)
kUAar8-Tvmw,Maybe The Combos Aren't So Bad When I Use Them #roblox  #jjkgame  #jujutsushenanigans  #anime,2026-06-19,Jujutsu Shenanigans (JJS)
6u1oq2rMhgQ,Maybe We Should'nt Fight  #roblox #jjkgame #jujutsushenanigans,2026-06-19,Jujutsu Shenanigans (JJS)
-CsWKx79qcE,Do you see the fit? ( Don't Mind The Titans)  #roblox #aot #anime,2026-06-19,AOT Revolution
9og0eNNSavA,Max Level In Sailor Piece!! (idk what to do now)  #roblox #anime #onepiece,2026-06-19,Other
D0AxD63MjvM,Gojo Vs Sukuna Domain Clash #roblox #jjkgame #jujutsushenanigans,2026-06-19,Jujutsu Shenanigans (JJS)
MjsZRQI4q7A,What is Mechamarus Ult #roblox #jujutsushenanigans #jujutsukaisen,2026-06-19,Jujutsu Shenanigans (JJS)
7KF-10-S2-I,Is The Game Really THAT Hard?  #roblox #aot #robloxgaming,2026-06-19,AOT Revolution
6brXA8ehxbg,Mei Mei new Combo...ig  #roblox #jujutsushenanigans #jjkgame,2026-06-19,Jujutsu Shenanigans (JJS)
f4iPhF9yr18,How Ten Shadows Got Me Moving. #roblox #jjkgame  #anime,2026-06-19,Jujutsu Shenanigans (JJS)
-yUHXb7YT7M,Destroying a 14k That Can't Take A Loss  #roblox #jjkgame #anime,2026-06-19,Jujutsu Shenanigans (JJS)
WybVU_6mqIQ,WE Still Playing Shindo? (Don't mind the animation)  #roblox #anime #shorts,2026-06-19,Shindo Life
X1y56qcs9_Y,Yamir really just don't care...  #roblox #aotrevolution #attackontitan,2026-06-19,AOT Revolution
Gs7I_3D4vIw,I Would Leave Too Bro...  #roblox #shindolife,2026-06-19,Shindo Life
hIzY_AluX-M,You Don't Need People To Jump Now In JJS...  #roblox #jjkgame,2026-06-19,Jujutsu Shenanigans (JJS)
Mb62ApCOUqk,How can I play the game if I can't even hit the npcs,2026-06-19,Other
KoZSO3n-wxM,{Blox fruits} I got super human,2026-06-19,Blox Fruits
14S4ZzaMYW8,I gave it everything i had...  #roblox  #anime  #attackontitan #aotrevolution,2026-06-19,AOT Revolution
Dzxc08S6LZM,16 hours for one item and it was worth it #BloxFruits #Grinding #Roblox,2026-06-19,Blox Fruits
2hP4Xy7z_c8,Finally after weeks of trying to get it I got it,2026-06-19,Other
8C_kD6HDFK0,POV: you finally get v4 #BloxFruits #Gaming #Hype,2026-06-19,Blox Fruits
SjjpHJ1m_KE,{Blox fruits} I got Yama,2026-06-19,Blox Fruits
hxTUtj4nCPE,Took me 5 hours to get it,2026-06-19,Other
9jHzpGLK7Ok,Getting Ture Azien.  #roblox #anime #robloxgaming,2026-06-19,Other
KqN_ojgfq3s,We actually have 100 subscribers #grateful #milestone #thankful,2026-06-19,Milestone / Community
gGmLKhducQk,Should I make wisteria videos? #roblox #poll,2026-06-19,Other
AMjfUmXONbI,I got dragon talon,2026-06-19,Other
2rv1qpQmDF4,Maybe I Should Put The Spears Down  #roblox #anime #attackontitan,2026-06-19,AOT Revolution
y7DYco-K98E,Welcome back to shindo,2026-06-19,Shindo Life
EnRU7Y6lzcs,Fastest Way To Kill Kuruma #roblox #gaming #shorts,2026-06-19,Other
DdcYbjoIgWo,Ty all for 350 Subscribers,2026-06-19,Milestone / Community
A4-P1bBW-ak,200 subs fr fr  #roblox #grateful #community,2026-06-19,Milestone / Community
vvNq1gHmPlc,I got electric claw,2026-06-19,Other
